{"schema_version":2,"id":"plains","display":{"name":"平原","description":"平原地表、下层与岩层，以及铁路沿线的局部起伏。"},"surface_voxel":"ground","subsurface_voxel":"subsoil","rock_voxel":"rock","local_height_noise":[{"scale_meters":140,"amplitude":0.7}],"decorations":[],"decoration_target_per_square_meter":0,"construction_site":"construction-site","railway_models":[{"tracks":1,"bridge":"bridge-1","tunnel_portal":"tunnel-portal-1","repair_site":"railway-repair-site"},{"tracks":2,"bridge":"bridge-2","tunnel_portal":"tunnel-portal-2","repair_site":"railway-repair-site"},{"tracks":3,"bridge":"bridge-3","tunnel_portal":"tunnel-portal-3","repair_site":"railway-repair-site"}]}
